{
  "pack": "rtl",
  "version": "1.0.0",
  "schema": "kb-rule/v1",
  "description": "Causal + structural RTL rules covering coding hygiene, FSMs, CDC/RDC, synthesizability, AI-origin hazards, DFT, and shift-left PPA prediction.",
  "stages": [
    "rtl",
    "synth"
  ],
  "tools": [
    "verilator",
    "slang",
    "yosys"
  ],
  "key_index": {
    "rtl.lint.latch.count": {
      "type": "int",
      "unit": "count",
      "description": "Inferred-latch count from Verilator/slang lint"
    },
    "rtl.lint.blkseq.count": {
      "type": "int",
      "unit": "count",
      "description": "Blocking-in-sequential lint warnings"
    },
    "rtl.lint.implicit_net.count": {
      "type": "int",
      "unit": "count",
      "description": "Implicit net / undeclared signal lint warnings"
    },
    "rtl.lint.width.count": {
      "type": "int",
      "unit": "count",
      "description": "Width-mismatch / truncation lint warnings"
    },
    "rtl.lint.case_incomplete.count": {
      "type": "int",
      "unit": "count",
      "description": "Case-incomplete lint warnings"
    },
    "rtl.lint.multidriven.count": {
      "type": "int",
      "unit": "count",
      "description": "Multi-driver / multidriven net lint warnings"
    },
    "rtl.lint.unoptflat.count": {
      "type": "int",
      "unit": "count",
      "description": "Combinational loop / unoptimizable-flat lint warnings"
    },
    "rtl.lint.hierref.count": {
      "type": "int",
      "unit": "count",
      "description": "Hierarchical reference lint warnings"
    },
    "rtl.lint.nonsynth.count": {
      "type": "int",
      "unit": "count",
      "description": "Non-synthesizable construct lint warnings"
    },
    "rtl.lint.full_case_pragma.count": {
      "type": "int",
      "unit": "count",
      "description": "Legacy full_case/parallel_case pragma occurrences"
    },
    "rtl.lint.fsm_no_default.count": {
      "type": "int",
      "unit": "count",
      "description": "FSMs lacking explicit default/reset state"
    },
    "rtl.lint.unreachable_state.count": {
      "type": "int",
      "unit": "count",
      "description": "FSM unreachable / dead state count"
    },
    "rtl.lint.gated_clock.count": {
      "type": "int",
      "unit": "count",
      "description": "Hand-rolled gated/derived clock lint occurrences"
    },
    "rtl.lint.cdc_unsync.count": {
      "type": "int",
      "unit": "count",
      "description": "Single-bit CDC paths without 2-FF synchronizer"
    },
    "rtl.lint.cdc_multibit.count": {
      "type": "int",
      "unit": "count",
      "description": "Multi-bit CDC paths without protocol/FIFO/Gray"
    },
    "rtl.lint.rdc.count": {
      "type": "int",
      "unit": "count",
      "description": "Reset-domain-crossing lint findings"
    },
    "rtl.lint.async_uncontrollable.count": {
      "type": "int",
      "unit": "count",
      "description": "Asynchronous controls not test-controllable"
    },
    "rtl.lint.defparam_or_define_config.count": {
      "type": "int",
      "unit": "count",
      "description": "Configuration via defparam or `define instead of typed parameters"
    },
    "rtl.lint.invented_primitive.count": {
      "type": "int",
      "unit": "count",
      "description": "AI-emitted primitives not resolvable to any approved library/template"
    },
    "rtl.fsm.encoding_declared": {
      "type": "bool",
      "unit": null,
      "description": "Whether nontrivial FSMs have an explicitly declared encoding"
    },
    "rtl.fsm.two_process_style": {
      "type": "bool",
      "unit": null,
      "description": "Whether FSMs use the two-process state-defaults style"
    },
    "rtl.module.max_comb_depth": {
      "type": "int",
      "unit": "levels",
      "description": "Maximum register-to-register combinational depth"
    },
    "rtl.module.max_fanout": {
      "type": "int",
      "unit": "count",
      "description": "Maximum control-net fanout in the module"
    },
    "rtl.register_bits": {
      "type": "int",
      "unit": "bits",
      "description": "Total RTL register bits (FF proxy)"
    },
    "rtl.memory_template_match": {
      "type": "bool",
      "unit": null,
      "description": "Memory arrays match an inference-friendly template"
    },
    "rtl.operator_max_bitwidth": {
      "type": "int",
      "unit": "bits",
      "description": "Maximum bitwidth of arithmetic operators"
    },
    "rtl.clock_gating_candidate_groups": {
      "type": "int",
      "unit": "count",
      "description": "Number of register groups sharing a low-activity enable"
    },
    "synth.warnings.latch": {
      "type": "int",
      "unit": "count",
      "description": "Yosys/synth latch warning count"
    },
    "synth.warnings.width": {
      "type": "int",
      "unit": "count",
      "description": "Synth width-mismatch warning count"
    },
    "synth.warnings.multidriven": {
      "type": "int",
      "unit": "count",
      "description": "Synth multidriven net warning count"
    },
    "synth.warnings.elab_failure": {
      "type": "int",
      "unit": "count",
      "description": "Synth elaboration failure count"
    },
    "synth.fsm_extracted": {
      "type": "bool",
      "unit": null,
      "description": "Whether FSM extraction matched declared encoding"
    },
    "synth.icg_inserted_count": {
      "type": "int",
      "unit": "count",
      "description": "Inserted integrated clock-gating cells"
    },
    "synth.dsp_inferred_count": {
      "type": "int",
      "unit": "count",
      "description": "DSP/MAC blocks inferred during synthesis"
    },
    "synth.memory_impl_class": {
      "type": "str",
      "unit": null,
      "description": "Inferred memory implementation: ff_ram | lutram | bram"
    },
    "synth.total_cell_area_um2": {
      "type": "float",
      "unit": "um^2",
      "description": "Sum of stdcell areas after synth"
    },
    "synth.ff_count": {
      "type": "int",
      "unit": "count",
      "description": "Post-synth flip-flop count"
    },
    "synth.top_module_by_cells": {
      "type": "str",
      "unit": null,
      "description": "Largest module by cell count"
    },
    "sta.wns_ps": {
      "type": "float",
      "unit": "ps",
      "description": "Setup worst negative slack"
    },
    "sta.tns_ps": {
      "type": "float",
      "unit": "ps",
      "description": "Setup total negative slack"
    },
    "sta.failing_endpoints": {
      "type": "int",
      "unit": "count",
      "description": "Number of failing timing endpoints"
    },
    "sta.hold_violations": {
      "type": "int",
      "unit": "count",
      "description": "Hold-time violation count"
    },
    "sta.reset_recovery_removal_violations": {
      "type": "int",
      "unit": "count",
      "description": "Reset recovery/removal STA violations"
    },
    "pnr.congestion_h_pct": {
      "type": "float",
      "unit": "pct",
      "description": "Horizontal routing congestion percentage"
    },
    "pnr.congestion_v_pct": {
      "type": "float",
      "unit": "pct",
      "description": "Vertical routing congestion percentage"
    },
    "sim.coverage.fsm_state_pct": {
      "type": "float",
      "unit": "pct",
      "description": "FSM-state coverage percentage"
    },
    "sim.race_condition_count": {
      "type": "int",
      "unit": "count",
      "description": "Detected simulator race-order divergences"
    },
    "sim.x_propagation_escapes": {
      "type": "int",
      "unit": "count",
      "description": "X-propagation escapes vs gate-level reference"
    },
    "sim.cdc_intermittent_failures": {
      "type": "int",
      "unit": "count",
      "description": "Intermittent CDC failures observed in sim/lab"
    },
    "power.total_mw": {
      "type": "float",
      "unit": "mw",
      "description": "Total estimated power"
    },
    "power.clock_mw": {
      "type": "float",
      "unit": "mw",
      "description": "Clock-tree dynamic power"
    },
    "dft.scan_coverage_pct": {
      "type": "float",
      "unit": "pct",
      "description": "ATPG/scan stuck-at coverage"
    },
    "dft.uncontrollable_async_count": {
      "type": "int",
      "unit": "count",
      "description": "Async controls not controllable in test mode"
    }
  },
  "rules": [
    {
      "id": "r_rtl_comb_total_assignment",
      "version": 1,
      "statement": "Every signal written inside an always_comb block must be assigned on every control path, typically via defaults at block entry then selective overrides; path-incomplete always_comb infers latches.",
      "kind": "constraint",
      "strength": "high",
      "status": "active",
      "applies_to": {
        "stage": [
          "rtl",
          "synth"
        ],
        "tools": [
          "verilator",
          "slang"
        ],
        "pdks": [],
        "design_class": [
          "any"
        ],
        "code_origin": [
          "any",
          "ai_generated",
          "ai_assisted"
        ]
      },
      "when": [
        {
          "op": "tag",
          "name": "rtl_stage"
        },
        {
          "op": "exists",
          "key": "rtl.always_comb_blocks"
        }
      ],
      "unless": [],
      "predicts": [
        {
          "measurement_key": "rtl.lint.latch.count",
          "channel": "intervals",
          "value": {
            "min": 0,
            "max": 0
          },
          "horizon": "rtl"
        },
        {
          "measurement_key": "rtl.lint.case_incomplete.count",
          "channel": "intervals",
          "value": {
            "min": 0,
            "max": 0
          },
          "horizon": "rtl"
        }
      ],
      "prevents": [
        {
          "downstream_stage": "synth",
          "downstream_key": "synth.warnings.latch",
          "mechanism": "Path-complete combinational assignment eliminates inferred latches before synth, avoiding silent CDC/STA hazards downstream.",
          "estimated_cost_saved_hours": 14
        },
        {